,,1309,"36f, 5’6”, overweight, caucasian

I had a colonoscopy in 2021 after experiencing severe pain and rectal bleeding (bright red and dark). Endoscopy was also ordered but they couldn’t do it at all. I woke up screaming in pain shortly after they started and they couldn’t go past my descending colon. They found 3 polyps (benign), largest 14mm, in my descending colon. GI doc kept saying I’m “too young” and my insides look like a 70 yr olds. Said I need to repeat the colonoscopy under general anesthesia and repeat again every 3 years. I had an upper endoscopy done in 2018 and also woke up freaking out during it. History of cancer on my moms side but not colon cancer. I’m positive for the v2424g high risk variant of the atm gene mutation. 

I had a lapse in insurance, moved, just saw a new GI doc in a new state to finally get this repeat colonoscopy done.

New GI doc said no one does colonoscopies under general anesthesia. End of story. She said *maybe* I can see a colorectal surgeon in a hospital who will *maybe* do general anesthesia in the OR if things go awry again. That was it and they canceled my appointment. 

Why would my last GI doc tell me to repeat it under general anesthesia when supposedly no one does that?

I don’t think I can ever put myself through that horrendous experience again.",,
,,1310,"Hello there, I (28yo native american female, 107kg, history of idiopathic chronic migraines and other symptoms ongoing since Nov 2022, MRI showed a empty sella potential indication of IIH but no other abnormalities, neurologist ordered a LP which indicated normal pressure, blood-work does not indicate any hormonal imbalance and is otherwise normal. - which all ruled out IIH and the neurologist diagnosed my symptoms as ""just migraines"".) have been having some issues with my lower back ever since I had a Lumbar Puncture on Nov 15th 2023. The procedure itself was uncomplicated, however I did have a PLPH for about 8 days after. I ended up in the ER 2 days post LP for the headache, the ER anesthesiologists were going to do a blood patch but decided not to due to me being sick with (self diagnosed, but confirmed not-covid) influenza A at the time and were worried about complications. Now it is Dec 26, and for about 5 weeks give or take l've been having worsening lower back pain. It feels like a sharp pressure, is worse when sitting and standing, bending in any way. Up until a week ago there was no signs of bruising or swelling but now there is slight bruising visible and some distension about 2-3 inches below the LP site and allot of pain. 
I had an appointment with the neurologist 2 weeks ago and he ordered a ultrasound of the area which is scheduled for the 9th of January. The neurologist viewed the site himself but at the time there was no visible bruising or swelling and expressed to me that he was not concerned at all; prescribed DICLOFENAC to apply to the area and do some stretches. However since then the pain has gotten worse and there is bruising visible plus it's slightly distended in the area which is not normal for me- which I have called him about but he said he's not worried and to wait for the ultrasound. I know he's the doctor and he knows best but I'm in allot of pain, the bruising is visible now and l'm scared and wondering what I should do. He won't even look at the bruising or talk to me. I guess I'm just wondering if there are any doctors or professionals who may have a different opinion or advice.",,
,,1311,"3 years old, 12.5kg, 95cm - what does the report mean?

Fecalysis

Color: Greenish Brown
Consistency: mucoid
Gross Evidence: with mucus
Red blood cells: 2-5 hpf
Pus cells: 5-8 hpf
Others: No ova or parasile seen.",,
,,1312,"20 afab

No drink no smoke
Propranolol 20mg x2 a day
Pristiq 50mg
Vyvanse 30mg as needed

So I’ve dealt with chronic headaches that often progress into migraines since I was like 10 and a few years ago I got prescribed propranolol.

The thing is, just talking with my mother now, she absolutely doesn’t believe that I’m taking it for migraines and that it’s for my anxiety. I do have anxiety but I am only finding on Google that propranolol taken for anxiety is just an “as needed” type thing and I take it twice a day every day. It is a very low dosage but I’m convinced my doctor just forgot to update my dosage once they found I had no adverse reactions because that is the lowest fucking dose ever??? Or maybe they forgot what they prescribed it for because I have chronic migraines and anxiety in my charts. And it’s no wonder I’ve seen that medicine do zero to help the frequency of migraines for me (but if I miss a dose I get dizzy so it’s doing something to my blood pressure) 
Even so, my mom swears I don’t have high blood pressure so they wouldn’t give me something to lower it. Lowkey fuming and also confused rn cause like I remember them prescribing it when I went into an appointment and told them my headache issue(not sure why it took so long for me to tell them).
I have a psychiatrist separate from my PCP at the same facility so they wouldn’t prescribe something for my mental illness when I don’t go to them for that. So what do you think? Is it for my anxiety or migraines? If this isn’t enough info I’ll just wait until my next appointment in February to ask my doctor but I decided to ask on here since February feels so far away. 

TL;DR: I take propranolol for migraines but my mom says its for anxiety when I don’t take it in the way that people who use it for anxiety do, but the dose is far lower than normal for an adult using it for migraines. I am diagnosed with both anxiety and chronic migraines so I’m worried my doctor just messed up the dosage and I’m also mad that my mom doesn’t believe that I in fact have high blood pressure (it runs in the family but I’m young so I MUST be in perfect health )",,
,,1313,"Male, 18, 6’5, 150, On lexapro. I have this weird clear bump on my throat, at first I thought it was tonsil stones but when i looked i noticed it was clear. Any idea what this is? It’s very annoying lol

[Bump Picture](https://ibb.co/G9hYfw7)",,
,,1314,"Hi,

33 year old Hispanic female. Height:5'7"". Weight: 146. Anemic due to heavy periods. Not currently on any medications. I occasionally take iron supplements.

I have been having pebble like stool for several months now. Recently, every once in a while, I bleed when defecating. It's usually on the toilet paper, but today I noticed some on top of my stool. I know I can not receive a diagnosis through Reddit but I have extreme health anxiety and wanted to get some opinions before my doctors appointment tomorrow.",,
,,1315,"I’m 24 year old white male 5’9” roughly 135-140 lbs
REALLY bad medical anxiety. I can feel my pulse wether I’m laying sitting or standing, some times more than others and see my stomach thumping with it and it’s driving me insane. Aneurysms are the scariest things in the world to me and this heavy pulse coupled with just an uncomfortable (not necessarily painful) feeling in my stomach has me terrified. The problem is if I went to the doctor everytime something medical scared me, I’d never leave. Please help me tell if this is an issue or if I need to calm down.",,
,,1316,"Male, 27, smoker.

Last night, I shifted in my seat, then I noticed back pain between my shoulder blades flare up. I'll be honest, I have bad posture. Anyway, the pain got worse when I moved around, especially if I tried to bend downward or move my shoulders back and forward.

It did improve after some moving around and a hot shower, but after a few hours, it began to slowly come back. When I got up today, it was more sore, and it seemed to spread to my chest a bit, especially when hunched over (my normal sitting posture).

Because it spread to the chest, I'm worried it's a heart attack, even though it seems very unlikely, given the symptoms. But I know I'm not a cardiologist and have no clue on the finer details of such things.

What do you think it is?",,
,,1317,"Age 21, Female, 5’4, 

I had an emergency appendectomy on Christmas yesterday (merry christmas to me), and I got sent home the same day of the surgery. I’m in so much pain I feel like they threw me out of the hospital so fast. Any tips on recovery? It was laparoscopic. Tomorrow I’m going to a nurse practitioner because my primary doctor is out of town. I have no idea about showering or taking care of the wounds I guess I find that out tomorrow? They also prescribed me tramadol and hydrocodone but I read online that you shouldn’t take these together so I’m confused.",,
,,1318,"24 female 
12 weeks pregnant 

For the past few days I have had reoccurring upper left abdominal pain. Seems to be right under my ribs and it feels like a sharp burning sensation. When it gets to hurting really bad I puke from the pain. Any ideas as to what could be causing this? Do I need to go to the er even though it comes and goes?",,
,,1319,"Hello all, 23M 155lbs. Just happened recently, went to pick up something and wasn't fully paying attention and got my scalp and it started to bleed not a whole lot but it was coming down to my face. Possible concussion?",,
,,1320,"38 year old female, 5’1” and 140lbs, medical history includes GERD, controlled migraines - taking prevacid and inderal for 10+ years. Several months ago I noticed a painless enlarged lymph node on the back of the left side of my neck because the back of my head had been itchy. The node has remained there the whole time and got a smidge larger. Then I noticed two more on the right side about 3 weeks ago and now another yesterday. I had an ultrasound last week which says they were favored to be reactive. My scalp doesn’t have a rash that would explain the itching. My PCP wants to repeat the ultrasound in 2 months but I’m just wondering if I should even wait that long and just see ENT. I’ve been asymptomatic aside from the itchy scalp on my occipital area, no recent illness.",,
,,1321,"This is the case is 11 months old male kid. Recently (02 months ago) hospitalised to manage stomach infection followed by high grade fever, vomiting, dehydration resulted in febrile seizures. (02 episodes on same day. 

Final diagnosis came as Seizures due to vitamin D3 deficiency. He is on vitamins since after that.

Now whenever he gets excited, he tights his hands and hands get tremors for few seconds and he is perfectly normal even in that period. This happens only in hands, no other body part is involved and resolved by itself. 

Milestones are perfectly normal. He walks with support and mimic few sounds, address us also in his limited vocabulary and very playful. 

One doctor suspected infantile seizures suggested MRI and EEG of brain other said it is not seizures but keep Midazolam Nasal spray ready at home to manage any emergency. 

We are confused and helpless. 

I have a 30 seconds video but don’t know how to upload it. 

Please suggest what we should do now ? 

Advance apologies for poor and broken English. I am not a native speaker.",,
,,1322,"Hi all. A family member was at work about 5 weeks ago when her eyes lost focus and then experienced a blinding-kaleidoscope vision. She was given a CT scan that found abnormal results. A few days ago, she received the results of that scan. I have researched it a bit and don't quite like what I see, but I thought I'd post it here in the hopes someone could better explain it:

""CT Impressions:

48 y/o female patient

Hypoattenuating focus of the left basal ganglia without surrounding edema or mass effect. This is non-specific but may represent a Virchow-Robin space. Recommend routine outpatient MRI of the brain and orbits with contrast for further evaluation.""

She is waiting to be scheduled for that MRI now. Since that initial incident, she has not lost vision but continues to occasionally feel pressure behind her eyes. No other symptoms noticed. I should mention that, on the day her vision changed, her blood pressure went sky high (her doctor believed it was due to panic as she does not normally have high BP).

From my limited research, I have learned just enough to be quite concerned. If anyone can shed some light on how they read this we would greatly appreciate it. Thank you!",,
,,1323,"For 8 months I’ve been dealing with this, and its really taking its toll. Symptoms are burning pain in urethra that comes and goes (and maybe bladder pain when its full, difficult to place exactly), and also burning sensation on the glans which is sometimes accompanied by a rash + meatitis. The rash is red, but sometimes pale spots as well.

Im getting quite desperate, so if anyone can help towards curing or alleviating this I will reward as much as I can within the rules on this subreddit.

I have tested negative for: gonnorhea, clamydia, syphilis, mycoplasma, trichonomas, ureplasma, hsv blood antibodies, hep-B. MicrogenDX analysis on urine and semen came up with only one detected bacterium (detected in both): enterococcus feacalis (which may be related, I don’t know). No findings on cystoscopy. No findings on biopsy from glans. No findings on urine culture.

I have taken: doxycyclin (2x100mg for 1 week), moxifloxacin (1x400mg for 1 week), amoxicillin (3x750mg for 1 week).

Timeline
- Week 0: unprotected oral with sex worker (idiotic, I know). This is likely the cause, but could of course be be a bizzare coincidence.
- Week 3: burning sensation deep in urethra
- Week 5: burning moving gradually outwards to also include head of penis
- Week 6: rash on penis (I have pictures if that helps) that comes and goes. Inflamed/red meatus urethra.
- Week 33 (now). Still having the same symptoms, coming and going on an hourly or daily basis. Although maybe slightly milder than the first 4-5 months.

Demographic info: male, 38 years old, normal weight, non-smoker.

Doctors have given up, so I hope there is anyone here who can help.",,
,,1324,"27F, no children. I got off birth control around April 2023. Immediately after I felt great- like I lost bloat, felt more energized, had high sex drive, etc. Probably 4/5 months post pill, l've had chronic yeast infections every month when I ovulate or start my period, a lower sex drive, and most recently bleeding when I have sex. My doctor has seen me through all of this and recommended I start diflucan every week for the next 6 months. I would like more guidance than that, though. What supplements should I be taking to support hormones? What levels should I be asking them to test for? How long after birth control does my body need to ""re adjust""? My provider is great but I just feel like there's something underlying that needs more attention.",,
,,1325,"With my first birth, they made 7 attempts to place an epidural and later a more experienced anesthesiologist made 10 attempts to place a spinal before surgery after. All attempts failed. I have had imaging done on my spine and all appeared normal (although the imaging was not done because of this).

I need a c-section for medical reasons and honestly I really don't want any additional attempts to place a spinal, I did not have a good experience the first time as local anesthetic does not work well on me due to EDS. They're pretty insistent that we try for a spinal before resorting to GA because it's safer. So I'm trying to determine how many attempts would be ""fair"" before I stop consenting to further attempts. I'm thinking 3-5? But I'm really not sure. Neither anesthesiologist wanted to stop last time and both were quite upset when I had them stop, so I want to establish this up front before they begin. 

Also, is this something where they should be using a new needle for every attempt?

Demographics info:
5'9"" 250lbs 32wk pregnant 27F, no medications, prior history of smoking medical marijuana, not currently smoking. 

Medical problems: PCOS, Hashimoto's, POTS, endometriosis, hEDS, suspected MCAS",,
,,1326,"21F, 160cm 48 kg. 
My sister has been having random waves of intense pain in her left and right iliac fossa with pain in her back too. 
She recently got worse, fever, vomiting and dizziness. 

So she went to the er yesterday, labs were said fine and abdominal ultrasound showed nothing. Though the labs showed high creatinine levels 99, sodium levels going down, small hematuria in urine. No alarming signs in blood cells though. No kidney scan was done. 

She’s in intense pain now, meds are doing nothing. 

What should she do ? She’s lost and the er team were over it because it was christmas night (which i can understand im a first year med school student but i am in no way fit to put a diagnosis so I am here to ask for what should we do ? )",,
,,1327,"18m, not on any prescriptions and as far as I know this is the only I might have had a siezure 

I've heard story's from different blood relatives about them having siezures but those usually involved then using hard drugs, aside from my mom who's told me about her having siezures from just smoking weed. 



When I was 17 I had what I now believe was probably a siezure after I hit a dab pen ( think of it like a weed vape. If the specifics matter it was a kind of delta). I was standing in the line to get the tickets before you can get into the movie theater and at first I'd noticed that I could no longer read the screen with all the movies listed on it. Then it quickly got worse with a sort of orange static coming over my vision. Then I started getting what felt like random shapes circling around my body and random vibrating. Then I tried to tell one of the family members I was with that something wasn't right but I was only able to murmur. After that I just saw different shades of purple and some random videogame characters for a couple seconds. Then I woke up confused on a sidewalk while one of my family members were getting their car to come get me. Later learned that It looked like I'd just passed out while murmuring. 




When I woke up it felt almost identical to when you wake up from a very deep sleep. I'd honestly still been convinced I was sleeping for atleast a couple minutes after I'd woken up. Then for a while after that I couldn't tell the size of objects. For example we'd stopped at a gas station and I'd accidentally drank out of a 2 liter of mountain dew because I thought it was just a regular one. But everything went back to normal after a couple hours. And when I talked to my mom about it a few months later she was certain it was a siezure because it was similar to her siezures. 

I've smoked and hit dab pens after this and never had anything similar happen. 





Only reason I'm not 100% convinced its a siezure is because the family members I was with have both actually had siezures before and they say it couldn't have been one because i never siezed or convolsed. And I'd never seen a doctor to confirm if it was one. I do wanna bring it up with an irl doctor when I'm able to afford one but that'll take a while.",,
,,1328,"https://imgur.com/a/8r8BovP

38F, 5’3”, 150lbs. Went to the doc yesterday. They said it was an abscess that they couldn't cut open because I have another small hard lump next to it and they can't confirm what it is so they want me to get an ultrasound. They only saw blood and pus but this came out in the shower after I applied more pressure. Is this a cyst? I don't want to do the ultrasound because it's still leaking. She didn't want me to get a mammogram because she said it would be too painful. Should I request one anyways if I can stand the pain? Thank you!",,
,,1329,"Hello, I’m male 28 years old. I finished my 2 dose Hepatitis B immunizations about 1 year ago and they were timed perfectly apart. I’m a gay male and go for STD screenings every 3 months. At the 3rd and 6th month after my HEP B immunizations I was positive for the antibodies with the HBsAb test. At the 9th and 12th month after my HEP B vaccines, I’m coming back negative for the antibody and my doctor is unsure if repeat immunizations are needed. What’s going on?",,
,,1330,"36 year old female. Not a smoker, not a drinker, and no previous surgery. I just did a MRCP for a mildly dilated bile duct issue and it came back normal. I noticed that on the report it mentions about bowel as well. It just said normal caliber. I do have digestive symptoms such as alternating between diarrhea and constipation, bloating and rectal pressure, and I’m waiting for an appointment with a specialist. In the meantime, I’m so scared of colon cancer. Can MRCP discover anything bad in colon?",,
,,1331,"17M

alright, a bit of context here:

around late 2021 I had covid. normal loss of taste and smell. couple months after I had covid my sense of taste got weird (things tasting weird/distorted) and I started having phantom smells, too.

the bad tastes got less severre, but i still have phantom smells which worsen occasionally. smells like metal and rotten food. this started 2 years ago, though. its been a long time, and long covid is only supposed to last ~<1 year.

I've seen doctors for this before, one told me it was long covid, one told me its allergies. I saw an allergist, who told me I don't have allergies.

I just wanna know what could be the root cause of this. Bit nervous to ask since I've googled this before (as I probably shouldn't have) and it showed me a lot of dangerous stuff. I dont smoke.",,
,,1332,"hi! i’m a 20F, 5’8, currently taking atenolol (doc thought i had hypertension, prob just white coat, cardiologist isn’t concerned about it and wants me off of it soon but taking it for anxiety rn). so i've been having this pain since right before thanksgiving (maybe a week before). i had eaten and that night i noticed bad sensitivity in my top teeth on my left side. i thought i had maybe flossed too hard and ignored it. it was extremely painful everytime i opened my mouth and air got in (even while trying to sleep). Well, since then, ive had bad pain right under cheekbone, all around the lower part of the left side of my face. i had been trying to get a dentist appt but nothing so im hoping i can get in this week if it is a dental issue. the pain went away for a couple of weeks but has been in full force the past couple of days. it's hard to pinpoint exactly where the pain is. the other night, i went to sleep while biting down on a wash rag cause it took away the pain, now, nothing. I've taken so much aleve, ibuprofen, and just now took some tylenol but nothing seems to help. even oragel didn't help. could anyone help me?",,
,,1333,"So tldr, coworker son has two large fecal impactions at the top of rectum. We were actually able to get out one through the help of a milk and molasses enema. One remains in the rectum but we aren't able to disimpact it as it's far too high up. We tried another milk and molasses enema but it didn't work. Nothing but the solution came out. We tried distilled water and soap suds enema and it didn't work either. We used a suppository but it was also uneventful. This has been going on for roughly a week give or take but we are getting worried. His son says his hand is starting to feel numb randomly through out the day and hes lost a lot of weight. We were turned away from the hospital 3 times but without any other options we went back today. Waited in the er and the doctor came out to talk to us roughly 4 hours later. She said that we were turned away last week and we shouldn't have come back. She wouldn't give us any treatment. We pleaded with her to help as the impaction is incredibly painful for his son but she said no and told us to leave but we were firm on seeking treatment. She called security on us so we had no choice but to leave. 

We don't know what to do. We were able to get one impaction out with milk and molasses but for some reason when we tried it later on, it never worked. Soap suds and suppositories didn't work and we are honestly really worried that the boy is going to die. People asked how old he is and he's 17.",,
