,,1255,"Hello! 16F who has been searching for an answer to my ear issues for a long time. No physical medical conditions, I take 5mg lexapro daily. English is not my first language, apologies for any misunderstandings.

My hearing problems started about three years ago, maybe even more. My little brother was quite loud and would almost always scream in my ear. I’m not sure if his screaming is linked to this, but around that time I started noticing my left ear being weird.

My left ear starts making static noises when I experience loud sounds that come from all around me. One of the most prominent examples comes from choir. I sing in choir and vocal ensemble, so I am constantly surrounded by loud sound. Whenever these sounds happen (when the choir starts singing), my left ear starts making static noises that drown out the choir, and even myself. My friends have noticed that I speak rather loudly, and find it difficult to identify sound dynamics in casual conversation (sometimes I speak too loud in a setting, even though I think I am whispering).

Another notable factor is that I have the ability to make my ears rumble. I have noticed that over time, the ability to make my left ear rumble is significantly less strong and slower. It just keeps getting worse. I heard something about this being due to having control over the tensor tympani muscle, so I am wondering if perhaps this may have to do something with it.

Finally, when I move my bottom jaw to the right, there is a whooshing sound that is much louder than when I move my jaw to the left. It’s like there is something opening up within the inside of my ear.

I have gone to many, many, MANY pediatricians and ENTs (drove hours to visit doctors to no avail). I did hearing tests, which all came out indicating that I was perfectly fine. But I had told them that doing hearing tests where I am wearing headphones don’t work, because for some reason loud noises do not bother me when they are from headphones, only in an open environment. They still said I was fine, said they would let me know the next steps, and never contacted us back. It’s been a whole year, and I had pretty much given up on it until I found this subreddit. 

Please guys, I really need a sense of direction on where to go and what to do next. This is plaguing me as a singer who heavily relies on my hearing abilities. I request your assistance and advice.",,
,,1256,"40f 163cm 70kg non smoker/drinker

Have had POTS type symptoms for 2 years since I began to get bilateral sciatica and had an MRI. This came back with central disc protrusion at l4/l5 causing lateral recess stenosis bilaterally with compression of both transiting L5 nerve roots.

Ive thrown a lot of money at finding the cause and have gotten nowhere so far other than low range ferritin. I very possibly have adenomyosis and endometriosis and have also been looking into pelvic congestion syndrome. Ive also heard of May Thurners as a differential diagnosis to these conditions and also in POTS.

I have my 2 year old lumbar MRI. I wondered if someone could take a look at the small videos I made of it to see if it is worth me pursuing a vascular issue like May Thurners where my spine issue is? I inverted the colours of one in the hope its more visble.

My symptoms that bother me the most are fatigue and brain fog and when I stand up it feels like my blood is heavy rushing downwards, almost dragging me down and I go dizzy, general dizziness and pelvic and back pressure and pain.

[Vid 1](https://yourimageshare.com/ib/F4f1T5TNvh)

[Vid 2](https://yourimageshare.com/ib/EGjovcZaMs)

[Sagittal at L5](https://yourimageshare.com/ib/XTAg1Z3C9w)

Im prepared for the comments about how its probably impossible to tell from these clips but I thought id give it a go anyway to try and save some money going down another pointless rabbit hole.

Thank you!",,
,,1257,"Male - 26 
Australian



Stomach grumbling (more so when passing stool)

Painless twitching (mostly right side colon area)

Pressure when I push out my stomach (bloat)?

Dispepsia (fullness feeling early on and after eating)


Yellow Mucous stool diarrhoea 

Constipation 

Gassy (burping more so)

Can’t pass burp gas fully (sometimes) after eating 


* will note I passed a normal looking stool yesterday (sausage shape) however today back to mucous diarrhoea and stomach discomfort",,
,,1258,"4 year old male Missouri.

Symptoms: Frequent Urination?
Medical Past: Hypospadias Surgery

Hi Docs,

We just have a quick question about our sons peeing.

Our son pees probably every 2 hours on average. He’ll have breaks after lunch or if we are out where he won’t go for 4 hours, just when we are at home, he goes more frequent.

No other symptoms, no excessive thirst, fruity breath, smelly pee, zero fatigue.

Is this timing for a 4 year old
Thanks again for responses!

SND",,
,,1259,"24 male.Heart rate has been fast lately,sometimes I feel dizzy.I can feel it becoming faster during when I'm trying to sleep.When I'm playing game it goes up to 100 plus bpm.When I'm resting it's usually 97bpm-60bpm.My blood pressure machine is usually around 60 pulse.How do I stop it from beating that fast?what's causing it.I excercise about 4-5 times a week,and weigh 45 kg.",,
,,1260,"I am 45 years old male，5-11” 151lbs. Got the rashes overnight and did the lab tests came back all negative. Doc suspected Pre-herpes. Pictures were taken 2 days a part 

https://imgur.com/a/ey3Hgzl
via Imgur for iOS",,
,,1261,"Hello guys, I have serious anxiety about this and I am not sure where to turn. I have a test booked for the New Year but my anxiety is getting to me now and I need an opinion!
Had unprotected insertive sex with a male almost 3 weeks ago.
1) I have been experiencing diarrhea which isn't totally abnormal as I have IBS
2) A subsequent partner has developed a very bad flu 
3) I've noticed that my neck and upper chest is itchy but doesn't appear to be a rash
4) Frequent Urination also
5) I have White tongue no lesions or anything like that at this 
6) I have a negative STI test that was taken 2 weeks post exposure
7) I feel nauseous but I'm convinced that's because of the anxiety.
8) Lymph nodes do not appear to be I flammed but I haven't got a Drs opinion on this 
9) I have developed a cold sore, I usually get them when I'm run down no canker sores though 
10) Shortness of breath and when I clear my throat there is a lot of phlegm built up 
Any advice is appreciated",,
,,1262,"my dad 57m 5'10 210lbs white, has been having periodic heavy swelling of seemingly random parts of his body. the first time he noticed it, about a year and a half ago, it swelled his right foot and it remained extremely swollen and itchy until his prednisone kicked in. he thought it was a mango rash since he's allergic to mango skin, but since then it's been occurring around once every month (sometimes every other). when it occurs, it swells up a random part of his body extremely quickly (around 3 hours), and he's had his tongue swelled, the top of his head, the bottom of his foot, his lips, his chin, his forehead, his left ring and pinky finger, and both ankles. Around a week ago, he began a chemo cream for skin cancer on his head and chest and last week his tongue swelled, and today his eyes completely swelled shut for an extended period of time. we took him to an urgent care and they gave him a shot and more prednisone. Usually after taking the shot, the swelling visible reduces within 20 minutes, but this time it seemed to get worse and it didn't react to the medication at all, in fact he noticed the bottom of his right food starting to swell also. he doesn't use any other medications apart from the chemo cream currently, and he drinks and uses recreational drugs, we don't have health care , and being in the US it's not in our best interest to go to a doctor, i'm open to any questions about his situation if you can help !!",,
,,1263,"Maybe someone can decipher what my 9yo daughter (45"" tall, 55 lbs) has. She woke up with phlegmy voice last tuesday, tested negative for covid consistently (including the final as a molecular with flu A and B tested). Since then her cough has stayed mild except in the evenings it's been more wet. Today (day 6) she had wet cough all day. She has not had any other symptoms the entire time: energy, temperature, nasal, sore throat, chest, or stomach. It has literally just been a phlegmy cough that was resolving before becoming more present today. Her energy has been fine and I noticed if I take her out for exercise where she's upright, her coughing goes way down, so I think part of it is post-nasal drip based on lounging at home.

The other variables are last week had terrible air quality where we live, and also the first really big rainstorm of the season on Monday/Tuesday, including strong sudden downpours which always affect our allergies. Her school spends a lot of time outside too.

She has no prior respiratory issues, allergies, or signs of asthma. She does have a history of heat sensitivity but it has been cool here (SF Bay Area)

If it wasn't a ""oh no I hope she's not getting us sick"" vibe and the fact that it's making her sleep bad, I wouldn't mind. But it's weird, it doesn't fit the profile for RSV and her molecular test was negative for covid/flu. I've had allergies all my life and they've never really presented this way either.

Any insight? I'm mostly just trying to figure out if she needs to see an allergist, as my wife and I both have really bad allergies and we were hoping she avoided inheriting them. Also, if it is a mild viral infection, is it at a point where it's no longer contagious?",,
,,1264,"I (16 year old female) have been having chronic lower abdominal pain (few inches below belly button) daily for about 1.5-2 years now. I’ve had blood work, urine, x-ray, stomach scope, and ultrasound. Nothing. It’ll hurt for like 10-20 mins at a time a couple times a day. Sometimes it’ll hurt daily for weeks or months at a time and then it’ll stop for weeks or months. Pediatricians have basically thrown in the towel and I’m getting hopeless. What should I do next? It is so painful during the flair ups I cannot stand and feel the urge to cry. I can’t stand this pain. Nothing I can think of could’ve caused this. (no medical changes before this started that I can’t think of or anything)",,
,,1265,"Hello, recently I (20M, 5’3” 110lbs, non smoker) have been a little worried. It started a few weeks ago when I ate some spicy food and then had to poop. Everything seemingly passed fine but it still felt like there was poop so I kept trying and then after a while I gave up. Since then, I have been pooping fine but one thing that worries me is a lump about an inch into my rectum that I felt in the shower. It feels like a little fleshy lump coming from the front of the wall which I would assume is making it kind of difficult to poop occasionally. It’s not visible from the outside, but if I feel it with my finger it feels fleshy on the outside but kind of dense. It hasn’t been causing problems so I’ve kind of just been monitoring it and feeling with my finger to see if anything about changes. The weird thing is there is no pain from it, both while pooping or when poking it. Is it just something I never noticed was there or is it new? it hasn’t been causing any pain and generally i’ve been pooping just fine, just a little concerned. Thanks!",,
,,1266,"I am a 39 year old male, 200 lbs, 5'8"", not currently taking any medications, and currently smoke about 1.5 packs of cigarettes a day.

So I have a variety of health issues, both physical and mental. Got tired of chasing the physical and ignoring the mental (even though I believe mental issues are physical at their root) and started seeing a psychiatrist.

After 4 visits, I basically got dumped. No fault to the doctor, she is limited to what help she can provide at that practice (virtual psychiatry).

She listed a laundry list as to why I need to seek neurological help. A schizophrenic mother, 4 moderate to severe head traumas, possible Lyme disease infection from a deer tick, a brown recluse bite (not sure why she listed that one), and a family history of MS and Lou Gehrig’s disease. She recommended I look into getting an MRI, electroencephalogram, and then brain injury rehabilitation.

I've been getting seizure like episodes from smoking as well. I know, I need to quit and have a plan for it.. but I never really pushed the issue with a doctor cause they are only brought on when I experience oxygen deprivation while smoking. Been happening for 3 to 5 years, lost track really, and happens at a frequency of anywhere between once every couple of months to 5 times a day.

But the other night, I got one for the first time not while smoking. I had a coughing fit and I am guessing that that somehow triggered it.

They only last about 5 to 10 seconds. I lose all my senses, can't see or hear anything. Sense of balance goes, and my hands will shake to where I'll likely drop whatever I am holding.

I am looking for a new primary care doctor who I can talk about all these and not feel weird.. and one with a good network so I don't get referred to some place that's over an hour away.

In the meantime, I live right down the road from the local hospital. Can I just go to the hospital to have an MRI and/or EEG done? I'd rather do that since I live so close, it's easier for me as I can't travel far, and don't have to wait for referrals and such.

Should I tell them about the psychiatry stuff or just go in after I have one of those mini seizures? I took the day off Thursday to go in, just wondering what the best route would be to get the things done that I need. Should I just go right to the ER?

Edit: I have decent health insurance, just finding a primary doctor I can talk to is hard. I'd rather show.",,
,,1267,"28F, approx 5ft5, don’t take any regular medication.

I have been prescribed antibiotics to treat H Pylori which has caused Gastritis.

If I have taken Doxycycline before will I be ok with Tetracycline? E.g. not allergic.

I have really bad medication anxiety and have out off treatment for so long due to worrying about this!",,
,,1268,"PLEASE HELP
19 Male, smoker, Taking mylan-Naproxen

I’ve had intense pain in my penis and testicles on and off for about 3 years. I’ve been to 7 ERs, 5 doctors appointments, a general surgeon, no one can help. I was diagnosed with a testicular hernia, but that was later ruled out as the cause of the issue. 

Sorry if this is not very articulate but I’m writing while having an attack of pain in the urethra. 
Usually it’s burning pain in the urethra after ejaculating, or burning pain in the ass hole (sorry I don’t know the proper term) or random intense testicular swelling. I pee every 20 minutes, my pee is sometimes cloudy or even bubbly. I really need help. Most recently I went to my doctor with a list of my symptoms and was given a test for sti’s and uti’s,which I would assume was negative because then I was prescribed with an anti inflammatory pain killer (mylan-naproxen) which seems like a bandaid solution, and like it won’t address the root of the symptoms. Anyways if anyone has an advice on some next steps that would be great",,
,,1269,"Male, 10 months, white 

Please don’t judge me, it’s currently 4 am and I can’t sleep. I went through a difficult pregnancy because of emotional stress and resorted to drinking on and off. My baby is 10 months old and will be turning 1 in February of 2024. Is he supposed to look this small at 10 months? Does he face look like he might have FAS? His pediatrician hasn’t pointed out anything but I feel like something might be wrong with him. Please advise me. Thank you 

Link: https://ibb.co/xz8TtKj",,
,,1270,"I am 25M. (5' 6'' and 185 lbs) I was ice-skating 5 days ago and had a bad fall. I got up pretty quick, but when I got up I knew I was done for the day and it is going to hurt the next day. As expected, it hurt pretty bad the next day. A little too bad, I couldn't get out of bed. I knew it was serious. For the first 3 days, I could barely walk or sit. I didn't have any problems during bowel movement though. Now it is day 5 and I can't stay in a single position (sitting, standing or laying down) for more than 30 min, before the need to switch. 

I wanted to go the a doctor but all the appointments are after new year. I cant help but laugh at the perfect time to have a bad fall. Please help me figure out how serious my injury is, and should I keep moving and stretching to have more blood circulate in that area? Googling abt this tells me at least 2 months of recovery? Is that true or is it google being scary google? Sometimes I feel my tailbone is broken, and the other times I feel, its not that serious when I compare to cases online and maybe its just a bruise. 


Please someone guide me and alleviate my concerns.",,
,,1271,"(No one wanted to answer, so removed)",,
,,1272,"26F, overweight 5’5, I vape marijuana 2-4 times a month, and I’m on sertraline and reactine every day as well as a liquid vitamin D supplement.

[Imgur link:](https://imgur.com/a/9mcAoUL) https://imgur.com/a/9mcAoUL

The arrows/circles on all photos are pointing to the same exact spot. I've tried coughing, gargling (regular water and mouth wash), drinking lots of water, and just leaving it alone. But I can't get rid of the feeling something is in my throat, and the dry cough is making my throat hurt. I was sick two weeks ago (for almost 2 weeks) and had a productive/wet cough, but now it's 99% dry and I'm positive it's because of this 'something is in my throat' feeling. I don't have bad breath which seems to be the most common symptom of tonsil stones but I don't know what else it could be. Last photo is just my throat. Idk if it was the camera flash but it seems red and irritated? When I saw the doctor 5 days ago he said it was just post viral cough but now it feels different, and cough medicine isn’t helping.",,
,,1273,"Been having bleeding in my stool on and off for years but most recently been having blood in stool for three months consistently. Just today my stool was covered in dark red blood like someone dipped my stool in a bucket of blood, should I be concerned? I also had bad stomach pains last night, almost like pins and needles which is new.

I’m only 27 male, 6ft 4 but am also a smoker and have lost 20 lbs in the last four months. No family history of colon cancer as far as I’m aware.",,
,,1274,"I \[26\] \[F\], 5'2"", 118 lbs. have had a 99-103 degree fever for the past 5 days. I feel noticeably a bit better today, but my temperature hasn't changed. I take lexipro and Nikki birth control. Drugs and alcohol very moderately (once or twice a month for both). non-smoker. up to this point I had violent chills, aches, some nausea (vomited once), mild tonsil ache. today (after 1 PM) I noticed an improvement in symptoms. I took the flu shot a couple of months ago and im covid -. 

im starting to worry that my fever isn't decreasing, though? cause for concern or will it just take time?",,
,,1275,"Good evening, I am 35f, 220lbs, 5”9 . I am currently taking Omeprazole, citralopram, lomaira (for weight loss) and Topimate (weight loss). I have been diagnosed with Celiac disease and Barrotts esophagus. In a few months my 5 year IUD (Mirena) will expire. For the past three weeks I have had some concerning issues. I started passing blood clots and mucus every time I went to the restroom. There would be blood when I wiped but never on my underwear. No cramping or anything else. Then a week late the blood clots slowed down but I was still continuously having white mucus come out every time I used the bathroom. Now this week the blood clots are back and I started spotting. Today I’m spotting even more frequently and much more bright red blood on the toilet tissue. Again no cramping or issues. While having the IUD I rarely had periods and if I did they were extremely light. Honestly I had more cramps then a flow. Could all of this be due to hormonal changes bc the IUD may not be as effective anymore? I checked today and could still feel the strings, so I feel like it’s still in place. I called my doctors office today but their system was down and so I’ll have to call again tomorrow. Thank you so much in advance!",,
,,1276,"My mom is 59 Female latina
Hello! I feel like my mom has bradycardia and a very irregular heartbeat for moments on the watch i put her heart goes to 40s even 38 bpm
She says she feels fine she goes out and walks I noticed yesterday
She does not want to go to urgent care and just plans to get a regular appointment 

I am thinking this is a av heart block type 2:1 from what i take on google 
Any opinion??",,
,,1277,"I am 27F and had my second child a year ago. I have experienced a myriad of symptoms since the birth of my second child, including rapid weight loss (40 pounds in 3 months from inability to eat, irregular periods, etc.) additionally, everytime I have sex, it seems to “kickstart” a period. A day or so after having intercourse, I experience cramping, generally on the right side of my abdomen and it can be mild or very severe, acute, and painful. This time around, it is severe pain on the right side and I bleed for upwards of a week, sometimes longer and the bleeding is very similar to the bleeding I experience during normal menstrual cycles. On top of this, I also have my regular menstrual cycles, so I end up bleeding for the majority of every month. Any insight is appreciated!",,
,,1278,"22F, Whenever I laugh hard or gasp I sometimes feel it, and it’s been more than five years… the cause was someone made me laugh while drinking water and it was much worse where I can feel it on command but now I feel it occasionally although it scares me that it’s still with me, it’s in top of my lungs near chest, about 2 coin size, when I touch it I can feel there space there like the muscle is not really strong there… like now when I laugh i get free package of anxiety if this is dangerous or if it can develop to another thing…. Like now I remember that it used to make me stop laughing still do but it used to hurt a lot and I would say out loud that it hurts and i didnt care but now its more subtle but it scares me cuz its here with me for all these years and sorry for this long paragraph I’m scared of my local docs because they ate more of plumbers so I really appreciate you for helping",,
,,1279,16f 55kg . I have been having these really bad headaches for a year now and they always get worse in exam season and at night. It hurts my ears eyes and the back of my neck. Ive been to a doctor already briefly and he prescribed me indomethacin and it does help but for an hour or two and i cant take more then two pills a day. At first he thought it was my sinuses because i had an infection before but when we did a scan they found nothing wrong even a blood test and my monocytes lymphocytes were a little higher then average but thats it the doctor said it might be from stress but he’s not sure (i think hes making it up bc he think am faking it to get out of school but am not) they hurt like a sting and sharp pain for a couple of hours in and out but then they go away. And ever since i started having brain fog and lacking motivation. Any advice ???,,
,,1280,"26F, no conditions/allergies

Last night my bf and I went out for dinner and I got a pumpkin pizza (there was no meat on it). This morning I woke up to extremely severe stomach pain and diarrhoea. The diarrhoea has since stopped after taking ‘gastro-stop’ but the intense, stabbing cramps in my stomach are still occurring now, 6 hours later.

I’ve never had food poisoning before, is this normal? I’m in so much pain!",,
,,1281,"Hi there, I’m M19 and i started using 2% Ketoconazole couple days ago as antifungal treatment. For the last week or two my testicles and shaft are really itchy. I itch them to the point where they bleed/release some transparent substance and when they dry up they are flakey and leather like.

I’ve noticed tonight that the shaft of my penis has small rash like bumps. Also it’d be worth mentioning that i apply the ketoconazole multiple times a day and quite a bit of it. I assume it may be that i could be having an allergic reaction to it?!

I’m just wondering if anyone could help me out or have a clue on what it might be and what i can 

TLDR - nuts itchy asf and gotten better then worse

[https://postimg.cc/gallery/2SwVCj4](https://postimg.cc/gallery/2SwVCj4)",,
,,1282,"28F
-Small bump noted -10 months ago (pic in comments is today)
I feel that it has grown and just doesn’t look quite right to me. 
-Thyroid labs are all WNL.
- Intermittent swollen lymph nodes.
- No globus sensation, no vocal impact.
- Supraventricular tachycardia otherwise unexplained but dx’d via cardiologist.
- No tobacco use, no alcohol.
- Weight gain despite tracked calorie deficit, 100g protein a day, frequent workouts. 

As the title says, does this look “off” or just another variation of normal?",,
