,,1334,"(23M) A full year ago in December, I remember waking up and the left half of my face was super numb, my arms were numb, and I couldn't formulate anything to say out loud. I was in a treatment facility and nobody was awake and I was too scared to bring attention to myself. I paced around and sat down and after an hour I went back to sleep. I was really concerned but didn't tell anyone because I thought they wouldn't believe me.

This year I have been noticing a pattern of emerging symptoms that I can't explain why they showed up other than continuing vaping. When I tried to take a break this year in September, after a few days, I noticed I was super fatigued, it was significantly harder to exercise, hard to enjoy food and walking around, trouble understanding, reading, and listening, darkened eyesight (like 50% darker), hearing damage out of nowhere, crinkling in my ears, extreme moving pressure in my eyeballs, trouble focusing everyday, hard pressure against my eardrum and in my middle ear, tensed up skull and neck which I can't get to relax, brain dullness, air bubbles in my skull,

And for the past two weeks panicking, heart racing out of my chest for the whole day, shallow breath. I think maybe all this is caused by something that happened a year ago.

I read people find out from tests that they had strokes several years ago and it went unnoticed, and I also read people as young as me (23) had a stroke for any reason. I now read you lose brain cells if it goes untreated and this is what it feels like is happening to me. My brain feels like it's dying and my eyeballs feel like they are constantly being cut off from blood flow/oxygen.

My doctor wont contact me back until the 11th because of the holidays. I had been trying to inquire about an ophthalmologist to help with my darkening vision. I don't want to go to the emergency room just to be told I'm just panicking but the reason I'm panicking is because I feel like I urgently need a CT scan to see if this actually happened. What else could it be? The morning I woke up with a numb half of my face and thought I had a stroke was one of the few things I remember from this long ago. Can anyone tell me what to do? I don't want to continue losing 2 million brain cells each hour, and it's already been a year since this incident. I don't want these weird symptoms I'm experiencing to be permanent/irreversible. Thank you for reading, I appreciate your time.",,
,,1335,"18M

175cm 

So yesterday I made myself some chicken nuggets got them out of my freezer and cooked them for about 10 mins after I ate one and half and noticed they were kind of odd by the taste. (they were hot tho ) So I checked their inside and they were raw, I was scared so I put them away.
How likely is it that I have salmonella?",,
,,1336,"2 days ago I went to the ER for abominal pain and got a CT scan (my 3rd one this week) the first 2 showed nothing but the last one showed a ""tiny fat filled umbilical hernia"". ER doctor didn't mention it at all, and I only noticed when I looked up my test results online. Been having belly button pain for years. 

Went back to the ER to talk about it and the doctor pressed in my belly button and it really hurt and he said it feels fine, the bulge must gave gone back in (I never even noticed a bulge to begin with)

But it literally hurts all the time. They referred me to a surgeon but I'm scared the surgeon won't care.

I have a sneaking suspicion that I might have hidden hernias in other spots in my abdomen because I have so much localized pain (or maybe umbilical hernia is causing the pain?)",,
,,1337,"I’m a 23 Male 5’7 and 72kg bodyweight 

Had a 4th gen Ab/Ag HIV test done 50 days post PEP of 28 days that I took for a low exposure and mainly due to anxiety. 

Do let me know if my results are conclusive and I can move on with my life. 

Thank you",,
,,1338,"Ok, so there’s no maggots inside my vagina because I don’t even have one. I tried posting an actual concern that doesn’t involve the emergency room but nobody seemed to give a shit. 

I (21m) took a blood test to measure my hormone levels. The first test came back with low testosterone. The second test came back with a normal range however it was still near the lower levels. Now my doctor can’t prescribe me testosterone. But I thought of something. 

What if the time I took the test affects my results? Men get erections all throughout the night in their sleep and when they wake up in the morning and have deeper voices. This is a sign of testosterone being higher at that time. Then throughout the day my voice doesn’t sound nearly as deep. 
The first result was taken at 2:00pm
The second result was taken at 10:00am
Then Google tells me testosterone has a circadian rhythm. 

I don’t feel like going into all of my issues but just know I have a majority of the symptoms of low testosterone.",,
,,1339,"26 year old female who in 2021 during the exam session (high stress) , the patient had daily spotting for 3 months and since mid 2021 she hasn't had her period not even once. She has been afraid to go to the doctor, but recently she has noticed an increased amount of facial hair and pimples. She doesn't want to undergo a blood test or even an exam. Any idea on what this might be?",,
,,1340,"41, female, anaphylaxis to tree nuts and sesame. 

We’ve all had a really nasty cough and cold for the last week. A few days ago we were eating some Christmassy foods from the supermarket and I felt like I was having an allergic reaction - itching inside my mouth, felt like hives on the inside of my lips. I’d already checked the ingredients and there was nothing I’m allergic to on there, of course I checked again. I took an antihistamine and it eased off. I figured there must have been contaminants. It didn’t get really bad and wasn’t a major issue. 

its just happened again after taking some cough medicine - I checked the ingredients, nothing on there that I know would cause me an issue. I haven’t taken it before so it’s possible I could react to it but I don’t understand why it would happen on these two occasions since it’s rare for it to happen. 

I rarely ever have reactions. I’m very cautious generally with checking ingredients. Last serious reaction I had was over ten years ago in a restaurant - I’d told them my allergies but they brought out some kind of dip and I ate a bit without thinking. I’m more careful since. 

Is it possible the virus could be causing this? I’ve never experienced this before unless it’s a known allergen. 

I’ve taken antihistamines and have two epipens and another adult here so if it gets worse I have a plan. My lips and inside my mouth are itchy but that’s it so far - breathing is fine.",,
,,1341,"M19. I have an aching pain in my left leg mostly near my shin and in both of my arms, it’s more severe around my shin. I’m not sure the cause of the pain I don’t do sports or go to the gym I do walk around a lot at work but that’s about it. I’ve taken Tylenol and ibuprofen but the pain is still there after I take them.",,
,,1342,"I fell down stairs Christmas Eve 12/24 10pm Arizona time. It's 4:30 am 12/26 & I can't sleep because of some pain. I just turned 24, about 90 pounds, 5'1. I fell & slid down 1-2 stair steps around my lower back above my butt. Not to be TMI but it's in the area above the crack, it just hurts & hurts to bend or move certain ways. I was in the car & a bump hurt & it felt like a pushing in sensation. When I bent down because I dropped my chapstick exiting the car & my dad didn't want to get it because he thinks I'm overreacting, I asked my dad to help pull me up & it hurt & I felt a pulling up sensation. I don't know if it's lower back or what it is but it hurts & I'm not sure if I need to see a doctor because I don't have health insurance. Certain sleeping positions also hurt & I stretched my foot to take off my sock & it hurt. After the car ride it started to hurt to walk. My dad forced me to get in the car so I'm not sure what to do if it got worse from that or if I need to see a doctor or if I'm ok. I think I saw some bruising in the indentation above my butt above the crack area but couldn't tell as it kind of hurt. What is it that I hurt/fell on & is it serious, should I be at the doctor/hospital? Please help.",,
,,1343,"Hi all,

34 year old, female, 5’6 tall, 11st 5lb; 
Non smoker. Take 20mg methotrexate for rheumatoid arthritis. 

I was prescribed Clarithromycin for a skin infection for 7 days. It has been effective in clearing the skin problem. 

Soft stools started on day 5 of the prescription.
Day 6 was 4-5 episodes of diarrhea. 
Day 7 was my last tablet. I had a formed poo that morning but then some softer ones. 
Day 8 today - woke up and had explosive watery diarrhea. 

I have no fever and not really any pain. Maybe a bit gurgly/uncomfortable before I go to the toilet. 
I am keeping hydrated. How do you know if it’s just diarrhea from the antibiotics or whether it’s c diff that I keep reading about? 

For context; I take 20mg Methotrexate usually for RA but haven’t taken it since starting the antibiotics. 
Thanks!",,
,,1344,"My otherwise healthy 7 year old came down with a sore throat and fever 12/5. He tested positive for strep and was given penicillin. Within a day or so he felt better, finished his 10 day antibiotics and the morning after his 10th dose, he woke up sore red throat and low grade temp. Back to the clinic and he tested positive for strep again. Given amoxicillin. Same thing happened. Finished his meds, felt great shortly after starting meds and by day 10, all good. 
His last dose was Christmas Eve night. Yesterday, 12/26, fever, sore throat fatigue etc. took him in to urgent care and he tested positive again. 

No one else so far has had it, although I can’t keep cleaning to this extent. We do our best to separate dishes, throw out toothpaste and brushes. 

How is he sick again? Is this a resistant strain? He is on azithromycin this time. 

He’s never had strep before this. In the past he has had Mrsa and impetigo, but even if tested for a sore e, he’s never had it. 

I don’t like seeing him sick like this and I’m not sure why the day after stopping meds, he’s sick with the same symptoms. It’s not respiratory. I’ve read there is no such thing as resistance to penicillin, and other places saying there is. 

This amount of antibiotics isn’t good for anyone and this time he was starting to get worse symptoms than the second time. I’m getting concerned and I’m not sure what to do. I’m trying to get him into a doctor, but we are in between medical groups after moving. Any idea?",,
,,1345,"Hello,
My fiance 22 female has been having problems with burning while urinating for quite a few years. Everytime she goes in to the doctors they tell her nothing is wrong and they typically give her antibiotics and this never fixes the issue. We have been to quite a few general health doctors and urologists. The only tests that they have done have been UTI tests. Does anyone have any advice on what may be going on and is there anything to test for? Are there any other specialist doctors we should go to? She is getting sick of going to the doctors office just to be told nothing is wrong when there is something wrong. As far as symptoms it's all the symptoms of a UTI but any UTI test turns out negative. The symptoms also come and go but they seem to be worsening. Any advice would be greatly appreciated.",,
,,1346,"Hey I’m a 31 female , pretty normal health wise had a partial thyroid removal due to cancer but I’m fine now and take thyroid replacement hormone everyday. 

I had a sinus infection last month and then got one again this month around the same time of month. This sinus infection has been more painful lots of stabbing pain in the sinuses , post nasal drip but not really any congestion or mucus being blown out of my nose it’s been like this for 5 days not getting better not getting worse and I’ve been managing with Tylenol sinus to relieve the head pressure. Today what felt like suddenly my eyes started getting goopy and green/white mucus has been coming out of them. My vision is cloudy and when the lights are on I see like a dim faded rainbow. It also feels like there is scratches on the surface of my eyes . 

Is it okay to wait until til the 27th when my doctors office open again or does is this something that needs to be seen by a medical professional ASAP? 

It doesn’t FEEL severe I’m used to managed mild sinus infections I’ve just never had an eye infection before so I don’t really know what’s normal or not.

Thank you for your time !",,
,,1347,"23F UK based no regular meds / no vitamins / otherwise fit and healthy psychically 

I was sick with a cold for three weeks. On 15th December my right ear felt ""full"" and was blocked with minimal hearing and with random pain depending on the pressure. 
On the 18th December i got diagnosed with an ear infection and she briefly mentioned ""bubbles on eardrum"" and prescribed me with a round of Amoxicillin.
I have finished the course and took it all correctly. The pain has gone however the tinnitus and blocked ear has not. I get random crackling in that ear that don't cause pain but are loud. It's affecting all of my life since my hearing is greatly reduced. 
Is this going to go away anytime soon? I don't know if there's something else i should be doing to get my hearing to return. Should i visit my GP, walk in clinic or accept my hearing may not return? Thank you in advance!",,
,,1348,"So I did the math & have doing an average 5 shots of vodka a day, it’s been on & off for months, but pretty consistent the last 2 months or so. 

What happens if I stop cold turkey? 

Can I just ‘drop down’ to regular wine & then slowly taper off the wine? 

I am already on Klonopin for anxiety/depression. 

My doctor gave me some leeway for insomnia, but my basic dose is spread through the day, for a total of 2.5 mg (3 if I can’t sleep). 

I am 45F, and about 115-120 pounds, otherwise healthy.

I am ready (so ready) to quit Vodka.

Do I need to worry?",,
,,1349,"23M, I’ve had this rash year after year and have always been told it’s an eczema rash, but it doesn’t seem to be eczema I don’t think, just wanted to clarify though. Can anyone give me an idea of what this could be? Thanks. 

https://imgur.com/a/jHV3K3k",,
,,1350,"(possibly nsfw, just mouth related) 21F, currently on sertraline & buspirone. For the last 5 days (this coming Friday will make a week) I have had 3-4 very painful bumps on my tongue, only on the outer sides and tip. I am such a hypochondriac and I can’t tell from googling if these are canker sores, lingual papillitis, herpes, or mouth cancer for all I know. I can’t stop stressing and it’s not seeming to get better with time. I tried rinsing with warm salt water today but that didn’t seem to do much. help :( 

(will try to put pics in comments)",,
,,1351,"28F diagnosed with Graves Disease and mitral valve regurgitation. In remission from Graves Disease. Not taking any medication and thyroid levels are normal. 
Haemoglobin slightly low (112) but nothing drastic. 

I train martial arts and have started going to the gym again. 

Particularly during martial arts trainings, I struggle desperately with running out of breath. I end up wheezing with vigorous exercise. 

At the gym, I start my session off with 10 minutes on the elliptical to warm up. My heart rate jumps up fairly quickly. Usually by the end of the 10 minutes it sits at around 170+. 

My partner said this isn't normal and his sits around 140 with this kind of exercise. 

I was misdiagnosed when my Graves first started rearing up and my resting heart rate fluctuated between 90-130 BPM for a long time. The doctor thought I had asthma. I could hardly exercise without almost passing out. My resting heart rate now sits between a normal 60-70. 

I don't know the impacts of being misdiagnosed for so long or the MVR, or if there are any at all. 

I feel like I shouldnt have the issues with getting fit and maintaining fitness that I do.",,
,,1352,"Does anyone know why a vitamin D3 infusion doesn't raise vitamin D blood levels? Is a conversion disorder possible?

I have a friend with severe weight loss, Reynauds symptoms too, and she has been investigated for everything they can think of.

She is low on magnesium, vitamin D, folate, all the b vitamins. Calcium is normal to high.

I am very worried for her, she is extremely frail, in hospital a lot, and everyone is out of ideas.",,
,,1353,"Christmas eve I had to take my wife to the hospital because I noticed a large bump near her rectum and she was having intense pain in the area. She ended up having a golf ball sized perianal abscess. 

An emergency OR team was called in and she had surgery within a couple of hours. They packed it and the surgeon told me the packing would be taken out before she left and she could go back to work the next day and to take some ibuprofen if she had any discomfort. Also said to clean it wish some dial soap in one of those bulbs you use for cleaning ears. 

Christmas night was rough, they never removed the packing so we called and asked about it and i was told I needed to remove it so that it didn't cause complications and by the next day we had to take her back to the ER because she was screaming in pain. I've seen this woman have large enough kidney stones that surgery was considered and this was worse. The hospitalit and ER doc both talked to my wife and were surprised she hadn't been given anything for her pain so they started her on pain meds and antibiotics because 1. She had been vomiting her antibiotics up from the pain and 2. Her heart rate and resperation were so bad that she triggered sepsis protocol. Those two doctors admitted her and moved her to the surgery floor so another surgeon could check on her when his shift started in the morning.

This morning we met with that surgeon and he seemed genuinely blown away by the fact that she was told to go back to work and take otc pain meds. He said considering she had a halfdollar sized hole with as many nerves as your eye has she should've been written off for at least 10 days and given decent pain medication. She should also be showering after any BM the first week if possible and doing soaks in warm soapy water. Also that we needed to get a peri bottle to effectively be able to clean the area if she couldn't bathe immediately after. All of these care instructions were left out by the first surgeon. In fact the after care instructions in her discharge consisted of ""follow aftercare instructions."" 

Considering 3 doctors, including another surgeon, were all shocked by the stance of ""go back to work and maybe take an ibuprofen"" I was curious what others thought about that choice. Is that valid advice from the original surgeon and the second one is just more worried about patient comfort? 

A family member of mine is convinced that it was done in retaliation for the surgeon being called in on Christmas eve but I couldn't believe a doctor would be THAT petty. 

I'm really just trying to gauge was this a valid call, was it ignorance, does it seem like malice. I don't know. I honestly don't plan to do anything with the information because my wife occasionally does work with this surgeon in her profession but for my own sanity I needed to get some other professionals opinions on the situation.

Edit: I just reread this (including the title) I'm sorry for the several typos. The last several days have been rough. I've spent every night but Christmas night in uncomfortable hospital chairs. I haven't gotten any real sleep in days.",,
,,1354,"20, 55kg male, would not of been concerned but they have a shiny texture so worried its some form of wart or something https://ibb.co/DQS4mKs
https://ibb.co/0GM2PP5",,
,,1355,"I (f26) masturbated with a hanger (not the hook side) and it had rough edges. Not really sharp, just hard. Anyway, I was grinding it in and out of my vagina super hard and fast until I decided to sit on it and I jumped off to the pain I felt. It felt like I hit the entrance of my uterus. I was drunk so I continued masturbating for a few seconds but laying down. Three days later I still feel irritated and bruised. It hurts to walk and lay down in certain positions. How long should I wait for it to heal until I can start squatting with ankle weights and having sex? Also, will my vagina go back to EXACTLY how it was before or will there be permanent damage?? I am freaking out.",,
,,1356,"26F, 125lbs, no medications 
I currently have no insurance no primary care no therapist. Even if I enroll in state insurance today I won’t get to see a therapist for some time. I feel like I need meds right now to be able to get through the day. My heart is constantly pounding and aching. I cannot eat. I am trying to force myself to eat anything with nutrition and I can’t stomach anything. I think my stomach is just really empty but it feels really uncomfortable. Almost like it’s swollen and I have to hold onto my right abdomen. I know if I go to the er and say I’m anxious they’re going to think I’m just looking for pills and assume addiction. I literally feel like I’m going to have a psychotic episode or my body will shut down if I don’t do something. I’m trying to stay active with exercising but it feels like it’s doing more damage to my body than good because I’m so weak right now. Should I just do like a 72 hour hold at a ER?",,
,,1357,"23yr old
Male
160lbs, physically active
Hey, so I recently switched from a high protein diet to a high Fibre diet mostly plant based, and I got some diarrhea and some darker red streaks in my poop. It looks similar to when I used to eat beets regularly, just some red cracks here or there but the poop itself looks brown and pretty normal, sometimes darker brown. Should I wait a bit and see if I get used to this diet? I went to call my doctor but they're away for the holidays so not sure if I should go to the ER for this or just wait it out. I don't have any abdominal pains and even when I ate meat I pooped pretty regularly. I was vegetarian for about 1 year before I switched to high protein, then I ate alot of chicken breast, yogurt, and still ate alot of whole foods, cooked and raw fruits and vegetables, lots of berries. I do eat strawberries and blueberries every day so not sure if that might change the colour of my poop. Thanks alot, I would include a photo but the red doesn't really show on camera for some reason just in person. Thanks for reading.",,
,,1358,"(26F / 5'6"" / 150lb) 

For the past couple days now, I have been experiencing this lower back pain that is significantly affecting my daily life. It is extremely painful to do normal things like walk stairs, use the bathroom, or get in and out of bed. I'm looking to see if there's anything I can do to remedy it myself for the time being (I tried taking ibuprofen and it did absolutely nothing). I am not sure if I should be staying up/active, or getting bed rest (because the pain is occurring either way).

Some details:

* It only happens when I move/sit/walk ""the wrong way"", but I generally do not realize which ""way"" that is until the pain already hits. It's not a constant pain and seems to be dependent on my position/movement, but it is random.
* It is localized to my lower right back. I would say near the sacroiliac region. It feels like a sharp stabbing pain, but it does not radiate down my leg like sciatica.
* I have scoliosis (diagnosed premenarchal at age 14, \~12 years ago); 26 degree right thoracic curve last checked Oct. 2013 after wearing an overnight back brace for \~2.5 years. 
* This type of pain has happened in the past many times but has never been this bad. It used to last longer time periods (\~1-2 weeks) with far less severity, but occurring more regularly. Now it occurs much less frequently and generally only lasts a few days, but it is extremely painful when it does happen.
* In the past I have been prescribed cyclobenzaprine (did not help) followed by steroid medication (also did not help). My PCP is a DO and I have seen her a handful of times to do a manipulation on my back, during which she said my right leg was longer than my left leg and I just needed to be leveled out (this only helped for short periods of time). I also did physical therapy for a couple months, after which the pain episodes became less frequent but more severe. I have always been told it's because of the asymmetry in my body from scoliosis and I've never had any type of x-rays or imaging recommended (not that I think I need it though).
* I have not experienced any type of recent trauma from exercise, injury, etc. or done anything particularly strenuous that could have triggered this. Any time I get this type of back pain, it occurs randomly (as far as I'm aware).

I appreciate any input or advice that anyone has. Thank you so much in advance.",,
