,,1199,"38 Male, 6 foot, 232lbs, White, Happened 11 hours ago in my bathroom, Non Alcoholic Fatty Liver Disease, No medication

At 8 pm last night, my wife and I had food poisoning that caused us to throw up. Was hickory farms sausage and cheese.

That said, her vomit looked normal. Mine on the other hand was bloody. The vomiting for me happened at around 2 AM thereafter. Only vomited once too. The rest of my bathroom visits were just diarrhea, which looked normal.

Below are links to the photos. Please understand that they are NSFW.

[](https://i.imgur.com/bqmgk3o.jpg)

[](https://i.imgur.com/aifl7zc_d.webp?maxwidth=760&fidelity=grand)

That said, should I be worried if this just happened once? Can I assume it’s just from the food poisoning?

Let me know your thoughts.

Thank you!

EDIT: My blood pressure is 104 over 86 and my heart rate is consistently over 100. Ranging 100-120 even after rest.",,
,,1200,"I (34F) started developing health anxiety this past summer. I came down with digestive issues. I shouldn't have done it, but I Googled and came across pancreatic cancer. Then, I went on the subreddit and saw posts by plenty of people in their 30s with this cancer. From then on, it was all I could think about. When I failed to get my symptoms (nausea, belching, burning stomach, acid in throat, lack of appetite) under control with OTC medication, I went to the ER. I was dropping weight, and I was 100% certain it was pancreatic. 

They took me seriously and did a CT with contrast, an abdominal X-ray, and tons of blood work. All came back clear, and then they scheduled me for an endoscopy which showed mild, chronic gastritis (inactive), and I started Omeprazole as well as Zoloft. Things were looking up for a bit as symptoms improved. 


However, now after a stomach virus, my symptoms have come back, and I'm once again in the pancreatic cancer spiral. I'm convinced the CT scan missed the cancer or the radiologist just read it wrong because I'm young. I can't stop thinking about it, reading about it, etc. 

I KNOW I'm being illogical. I KNOW I should bring this up to my GP. However, I'm scared if I do, I'll be labeled as a hypochondriac and from then on any health concern I have won't be taken seriously. 


What should I do??",,
,,1201,"I am a 41 year old female. I don’t smoke, I kickbox 4-5 times a week, have no dietary restrictions, am not taking any medication, and have a drink a few times a week. I have no allergies besides penicillin that I know of. I have a strange occurrence happening every once in a while. Starting about a year and a half ago, my left eye would feel numb/cold in one spot (almost like someone was blowing into it) along with a line of my left lip directly below the eye but not on my cheek. This happened just a few times the first year. After the 3rd time, I went back and noted the time it happened, what I was doing, and what I had eaten. There were no correlations. This August until now, it has happened monthly and lately sometimes happens weekly. The tingling/coldness/numbness occasionally starts out on one side and moves to the other side. It’s almost always in my eye and just a small part of my lip. No one can see or feel anything different in my face when it’s happening and I can move all parts of my face. (I had our school RN check me out once when it happened at work.) I finally went to the doctor and he ran tests to see if I was vitamin deficient because he couldn’t think of anything else. Tests came back normal. He said he wasn’t worried but I could do a brain scan if it kept happening. Since my appointment it happens weekly or every other week but doesn’t last long. Any ideas of what could be happening??",,
,,1202,"Gender - Female
Age - 35
Weight-89 kg
Location india
Occasional smoker although haven't smoked in months

I have been dealing with mild cold and cough that seems to reoccur a few times a year. However in the last 2 months my cough has been persistent and has not really gone away. It is usually accompanied by runny nose, sinus and low grade fever. I have been coughing since the start of the nov. I have wheezing as well. My doc suggested its COPD and caused by pollution, we do live in a highly polluted city. I did react well to allergy medication, wheezing went away but the cough returned. The dry cough turned to wheezing again along with cold. 

I did a complete blood test and a chest xray. Blood test shows high level of IgE serum shows high as in the bio ref is 0-100.0 and mine shows 210.3 
Rest is pretty ok, my WBC count is slightly higher. 

But the XRay report says ""Soft Tissue opacity is seen widening the right paratracheal strip- could be enlarged lymphnodes'. I have been told to go for CET scan. 

What could this possibly be?",,
,,1203,"So basically I boxed my friend while drunk last night and took some pretty bad blows to the back of the head. My friend has no experience in boxing but weights a good 30 pounds more than me. The fight lasted like one minute so it wasn’t like I got pounded for an extended period of time.

I did get punched a couple times in the back of the head and the next morning it hurts when I shake my head. No nausea, sensitivity to bright light, or other concussion symptoms (I think).

I think I’m fine but I am pretty anxious about brain damage or some kind of brain bleed. I don’t plan on taking anymore blows to the head. 

Should I see a doctor or am I alright?",,
,,1204,"I (31m)have had some anal pain for the last year. I got an MRI done and have no idea what the notes mean. Please help me understand. I do not take any medication. 


IMPRESSION: T2 hyperintense linear polypoid structures noted beginning at the caudal one third of the anal canal near the 7 o'clock position. This extends inferiorly to the anal verge and measures 2.0 cm in extent. This may be confined to the submucosal space and does not clearly extend through the internal anal sphincter to the intersphincteric fat. This is a good correlate for the reported hypertrophied anal papilla seen at anoscopy. However, a sinus tract or fistula confined to the submucosal space is not excluded. Clinical correlation is advised.",,
,,1205,"Hi, my little one has a fever, a really runny nose, and some gunk coming out of her eyes. She also seemed to be in pain with her ears last night. I’m booked in with my local GP on Thursday, but I’m worried to death. Anyone got any ideas about what it might be?

3 years old, female, no previous medications. 

https://imgur.com/a/kxyqADy",,
,,1206,"Hello,

Does anyone have any recommendations or took any medications for swelling after a fracture? My father is 70 years old (male and has high blood pressure) and has a Weber B fracture to the fibula (happened approximately 8 weeks ago) and still has a lot of swelling, especially when he puts his foot down. He is having trouble walking because of the swelling, is there anything he could take? His fracture is still healing so we don’t want to take any medication that can slow or stop the healing.

Thank you",,
,,1207,"Age 33

Sex F

Height 5' 4""

Weight 150

Race White

https://imgur.com/a/u291JoN

On Nuvaring 15 years and honestly not as consistent as i should be with removing for periods. I removed it last night and had light spotting almost immediately (usually takes 2-3 days for period to start after removal). No cramps, no pain, woke up a bit heavier flow than normal but not enough to use a pad/tampon. 

Headed out for a run and 3 miles in, I felt THAT feeling. I still had 3 miles left and thought I was going to be bleeding through my shorts with how much blood it felt like had come out. Got home and went to shower expecting a bloodbath. Looked down and did a double take thinking my vagina had fallen out of me - the sex education system seems to have completely failed me. Removed ""the glob"" and mushed it around some trying to figure out what the he*l it was. 

Internet seems to say Decidual Cast but we all know Reddit has the actual answers - can someone help me ID this? Also, everyone seems to agree I should have been having some insane cramping along the way but I feel completely fine. Not a single cramp, no back pain, no nausea - I really don't know what to think. 

I'll take any information and tips you have friends 🧡",,
,,1208,"Male. 18 years old. Smokes cigarettes, occasionally drinks alcohol and occasionally smokes weed. I have a headache only when I workout. Started 2 weeks back and it’s a severe throbbing headache that happens only when I workout. My entire head hurts not just a part of it. No nausea or dizziness or vomiting. Never had this before but it happens only when i do strenuous physical activity like working out. I take creatine, whey protein and preworkout everyday alongside multivitamins, omega-3 and biotin supplements. My hydration is also good and I sleep for minimum 8-9 hours a day. I also took a break from gym for 3-4 days and when I went back I still had the headache. I thought it was due to the weight being too much for me but I noticed it happens even when I do body weight exercises like pushups and pull-ups and still happens even if i decrease the weight by a lot. however, it doesn’t happen when I do boxing. I went to a general physician and he told me to have a neuro vitamin called Renerve Plus but it doesn’t seem to work. I also considered changing my routine from going in the morning to going in the evening but it still happens. Any advice as to what it could be?",,
,,1209,"I posted this on many subs and got removed for ""personal questions"". So thats my last stand.

Please, if you are a doctor or medical student or healthcare professional, read this appeal. 
Good evening users, I don't know if I will find any kind of answer here but it is worth trying having faith in the power of the internet. I'm 24 years old and my brother is exhausted just like us. My family has literally been plagued by an illness for a year and we can't get over it. It all started in January last year, when I had violent gastroenteritis (jet vomiting) for two days. Everything seemed normal, a banal gastroenteritis or intoxication (as fate would have it, a Japanese restaurant served me raw chicken a few days before and I realized it too late). After 5 days the nausea and intestinal pain do not go away, and my brother shows the same symptoms. To make a long story short, a year later we are constantly suffering from nausea, abdominal pain, dyspepsia, hyperacidity and cramps. I can tolerate the pain and nausea and am able to lead an almost normal life. No, my brother is 28 years old and can't get out of bed. He is weak and no longer eats, he has lost weight and has lost muscle mass. Every now and then he has a good week in which he manages to eat enough to not suffer from pathological anorexia, but he is still underweight. We spoke to immunologists, gastroenterologists and psychologists, IT'S NOT PSYCHOSOMATIC! We have done all kinds of tests (unfortunately ruining ourselves financially) and we highlight dysbiosis and positivity to Cytomegalovirus. In the hospital they can only give him a few infusions but they don't admit him until his life is in danger. A few years ago my brother suffered from a serious evolution of mononucleosis which took him to hospital where he was severely immunosuppressed and where he was also wrongly diagnosed with HIV while awaiting tests. We are desperate, we don't know what to do, I can live with this disease, my brother can't.",,
,,1210,"Female, 32, and I think I would be about 3-4 weeks pregnant if I am. My last period started 12/1/23, although it was very light and short. I tested positive on an ovulation test strip around cycle day 11 or 12. 
Does this ultrasound indicate early pregnancy at all? I also tested positive on an at home pregnancy test and had a transvaginal/abdominal ultrasound done (not related to the pregnancy test). 

My doctor is out so he hasn’t responded with the results and I’m being impatient. I know the doctor will be able to give me an answer after reviewing, but if anyone has any insight while I’m waiting for his response, I would appreciate the feedback! 

These are just 2 photos of the ultrasound, a lot more were taken but I’m wondering if there may be a sac on these? Also, my endometrial stripe was really thick. I’m not sure what that indicates.

Thank you!",,
,,1211,"1 (34f) have been having abdominal problems for around 2-3 weeks. I usually get really bad heartburn if I don’t watch what I eat so I apologize if this seems obvious on where to go. About 2-3 weeks ago I ate a heavy meal with chocolate and a cheeseburger (been fixing up a house so plz don’t judge me for that.) everything seemed fine and waited my time limit before sleeping. Woke up about 5 hours later to extreme bloating feeling and pain on the upper right side of my stomach. I paced around for 3 hours in this pain debating on going to the doctors. I took tums, omeprazole (40 mg) and Gaviscon. After 3 hours it subsided and I never went in. Over the next few weeks I could still feel the pain in my upper right side of the stomach but it was lessened and felt like it was on the mend. A few days ago the heartburn started getting worse despite eating light, eating heartburn friendly foods and taking 40-80 mg of omeprazole, 4-5 ultra strength tums and a sip of Gaviscon. My chest down my spine hurts the worst but my whole chest feels like acid is splashing around the entire chest cavity. Been having off and on diarrhea. Regardless of diarrhea or not, it’s always yellow in color (sry for tmi). And having incontinence and bladder pain if “full” even when it’s a normal amount. If you can give some advice on what to look for as well that would be amazing.",,
,,1212,"Female, late 30s, no relevant medical history apart from that I don't remember ever having swollen tonsils before. 

Around 12-18 months ago I noticed a little pink nubbin by my tonsil. Showed the dentist, declined a referral to ent because I'm petty and they disappointed me a few times already. I saw maxfax who said they don't do tonsils but it looked ok. I mostly ignored it and the dentist had a quick look to check it hadn't grown on checkups. Had a bad cough around November and I looked because my throat was sore and the nubbin was purple. A few days later it was yellow and then it disappeared, likely just swallowed it in my sleep. While it was there I would squeeze tonsil stones from behind it every so often. So I started again about a month ago, and this week I noticed the hole there. Not sure whether to just stop messing and wait till I see the dentist in Jan/Feb. But will it get disgusting if it's not cleaned out? 

Excuse the photos that will hopefully get posted in the comments, it's a hard place to photograph with a rubbish phone camera. It looks kind of tunnelly, but the only things online are branchial cleft things and crypts so going with the most common till proven otherwise.",,
,,1213,"I am 27 year old female. 

I am taking HCG injections (human chorionic gonadotropin, will this medication cause a false positive?",,
,,1214,"Recently had a vasectomy and had 2 incisions. The left one isn’t looking as good as the right one. I’m worried that it might be infected slightly but it’s hard to tell (funnily enough, not a doctor 😂) or it may just be the dissolvable stitches.

[NSFW photo of stitches](https://ibb.co/0m3f9wK)

Info about myself: 31 Male, no medication, no associated side effects (high temperature, pus, increased pain etc). 

Date of surgery: 13th December 2023",,
,,1215,"hello im 17, male, 5'8 and 140 lbs, for like a week or two ive been experiencing pain and numbness on the right side of my body, all the way from my head to my foot, metallic taste in my mouth, vertigo, dizziness and im quite tired during the day. im guessing theres some kind of nerve damage involved but google searches have been pretty vague, so i thought id ask here",,
,,1216,"My wife (26 years old, female) stepped on something like a dirty wooden toothpick that went into her foot a few weeks ago. She went to the doctor and they told her it was infected and the took an X-ray. The X-ray came back saying there is a small piece still in her foot. The doctor referred her to a podiatrist who doesn’t have availability until January 19th. Everywhere else she calls says they either can’t do anything or don’t have availability. When we called the original doctor back they said if it gets reinfected they would just give her another antibiotic. This feels more urgent to us but we cannot get anyone to help. Is the best option really just to wait until January 19th or should we keep pushing to get in somewhere this week? Thanks in advance!",,
,,1217,"36m 6ft 205lbs USA Light smoker, quit drinking, subclinical hashimoto's, celiac.

Happened again last night. Pain is in left pectoral area(bottom right of center left pectoral). I can breath ok, pulse feels fine, but when I breath in a little to much the is very sharp pain. It slowly goes away as I force in a little more air with each breath, like I'm stretching out the area. I think this happened once or twice over the last few years, but never this many in this short amount of time. I did exercise yesterday and did a lot of push ups. Any name to this? Hoping it's not some build up to heart attack.",,
,,1218,"I had some stomach problems \~3 months ago and got a stool culture, which revealed Shigella. My doctor told me my gut would take time to recover, but that it should be back to normal after a few months. He recommended probiotics, which I take every day (sometime a pill, sometimes yogurt).

I used to drink a lot of regular coffee but after this infection even a little bit of regular would cause me diarrhea, so I switched to decaf. I still have instant diarrhea if I drink any regular coffee. I used to never have any trace of loose stool ever, very much the opposite. So I'm wondering if it is likely that I still have some kind of Shigella infection, or if my gut bacteria is just taking longer than normal to return to normal.

30M, 5'11"", 180lbs",,
,,1219,"15F, 175cm, White British. I do a lot of art, writing and I play a lot of video games, specifically rhythm games. About two years back while I had exams there was a period for like 2 weeks where I couldn't do any of these things because my right wrist just hurt so bad, mostly from all the extra work, and I also have ADHD so I can't really stop myself from doodling. I told my mum this and she didn't see it as a large issue and that it was just form all the exam cramming.

I've noticed since then I can infinitely 'click' my right wrist, I asked my brother and friends, they can't do that If I move it sometimes it'll just click by itself and I get writers cramp way easier than my friends. I've started taking breaks between games and stuff but sometimes by the end of my school days I can't write at all. I remember it first starting when I joined secondary school (so about 4 years ago now). I've started playing less games and trying to take more breaks at school, like not drawing at break/lunch but I just don't know.",,
,,1220,I got tested today for gonorrhea and chlamydia so I’ll see if I have that but the thing that worries me is I get a pain when I get hard and got the shot today on my butt to cure gonorrhea but I’m scared about my dick atm,,
,,1221,"Male, Age 29, 5’11”, also have raynauds if relevant. Photos attached below.

I split my finger tip open between two heavy things on dec 18th and about like 2 hours later got a stitch from a Doc at the hospital to try and hold it. The doctor tried to push a bit of the inside swollen tip that was out back in on one side but couldnt get it to go back in. The small protruding bump on my finger tip now is not the same spot as the fleshy bit he was trying to put back in. The tip is hard and my finger much still bit swollen as i cant bend it fully still. It doesn’t hurt anywhere on it anymorez

I have been wearing a medical cotton pad over it, washing it with mild soap and water once a day now that its closed (drying well after), and putting polysporn every day.

Does it look okay? 
I worry about infection or loss of finger tip!

Labeled photos below of today (Tuesday) and this past Sunday 

https://imgur.com/a/2RZt5eS",,
,,1222,"I'm a 33 year old female, 159lbs, 5'8 or so.

I've been sick with some mystery illness for three weeks & the biggest symptom I've been dealing with is a very, very sore throat. It's like right in each of my tonsils & I can feel it so bad when I swallow or eat so I'm not eating. It's the worst sore throat I've had to date. I also have a lingering semi. productive cough that was very productive prior to one round of doxycycline. I finished a 7 day course of the doxycycline & was feeling better mostly minus a very dull pain still in my throat & a normal cough. & To note, I've been swabbed for flu, covid, strep, & RSV. All negative. 

Fast forward to a week later. Excruciating sore throat is back, cough is there but is only really bad at night where I cough so much I nearly throw up all night. 

My primary care Dr gave me a steroid shot today & prescribed me levofloxacin. Since I'm coming back negative for literally everything & he said the doxycycline didn't seem to do the job fully, he said he was putting me on a strong antibiotic & if I got a side effect like leg aches not to worry, to just finish my course because it's common. 

So naturally, I went to Dr Google & freaked myself WAY out over the chance of becoming what they refer to as ""floxed.""

How common is this? Any knowledge of this particular antibiotic? I saw someone even say it has a black box warning that it could cause nerve issues which I already deal with. I'm very hesitant to take this, but I'm not getting better & I can't handle the pain of the sore throat anymore. Any words of wisdom from those who definitely know better or who have personal experience with this medicine?",,
,,1223,"After watching [this](https://www.reddit.com/r/nope/s/Ikg10WP5f4) video, I ordered an earwax cleaner/camera and we tried it out tonight. My daughter (19F, 5’0’, non smoking, no medication, 170lb, no medical issues), has a white ring around her eardrum and a cursory google search says myringosclerosis. Should I make her an appointment with an ENT? [Picture from ear camera](https://imgur.com/a/AFF8ocW). Thank you.",,
,,1224,"21F 
5ft
135 lbs
(i’m on mobile so i apologize for any format issues)


I just developed this weird formation of wounds on the back of my calf a couple days ago and am out of state away from my insurance and doctors. The anxiety of not knowing what it is, is eating me up. I take Auvelity for mental health problems.

https://imgur.com/a/zvUsjAJ",,
,,1225,"Started off as a red bump (cyst/boil?) that felt deep in the skin, swelled and became purple, popped, been purple/black since and now looks like this (pics below). Only hurts a bit when touched. Been keeping area clean with routine washing and some salicylic acid. Any advice or take up with my PCP?

https://ibb.co/GRLspZv
https://ibb.co/hH1Hjsb
https://ibb.co/Yj97b8K",,
,,1226,35m 6ft. Tooth hurt when pushing. Wind hurts. Cold and hot hurts. I tried Ibroprofen,,
,,1227,"Ive been having a some chest pain that is made worse by me breathing, or doing any sort of exercise including walking, thats gotten worse the last couple days. My neck hurts too but i dont know if its related. I am also super short of breath. Ive been short of breath sometimes for the last couple months, but that was after like walking 100 feet, or eating super quickly, but its gotten worse the last couple days. Im out of breath from talking, walking short distances, and even just standing or sitting/laying down. My heart rate has been high the last couple doctors appts ive had. My resting HR at drs appointments is usually 70-75, but the last ones were 115-120. They thought i was nervous and told me to calm down but I was calm. Ive been having more of a headache than usual the last couple days as well and dont know if its related as well. The doctors said my blood pressures been fine, 110-118/87-90. My vision has been blurry when im standing/walking for a while. I have a cardiologist appointment scheduled, but its in febuary, and i cant book another one until april. 
Ive called my normal cardiologist who's receptionist said shed talk to the nurses and theyd give me a best course of action, but havent gotten that call back. I also asked them if me getting a sooner appt with a cardiologist at a different practice would be okay, but they said i shouldnt do that. 

The ER in my town is not a good one. Its always packed, and the doctors just are rude and dont care. I waited 5 hours in the waiting room with a dislocated collarbone. All for them to get some x-rays, say theyve never seen this before, and send me home. No sling, no pain meds for me with a bone out of place for 7 hours, nothing. 

Ive traveled out of the US, was eaten alive by mosquitos in the Dominican Republic. That trip was from 12/9-12/15 of this year.
My legs swelled up to about double the size with the plane travel.

18 afab
5'6""
170lbs

Current medications: 
Duloxetine 90mg once a day (Morning)
Midodrine 4mg twice a day (Morn+afternoon)
Celebrex 100mg twice a day (morn+afternoon)
Tramadol 50mg twice a day (morn+night)
Lithium 150mg twice a day (morn+night)
Naltrexone 4mg once a day (night)
Mirtazepine 30mg once a day (night) 
Vitamin D supplements
Calcium supplements
Magnesium supplements

Medical Conditions:
Ehlers Danlos Syndrome (Hypermobile type)
Dilated Aorta (watching w/yearly echo)
Bicuspid aortic valve (watching w/yearly echo)
POTS/Dysautonomia
Theres more, but these are the relevant ones.",,
